{
  "$schema": "http://json-schema.org/draft-07/schema#",
  "$id": "https://github.com/DDinggi/pokesim-kr/blob/main/data/schemas/set.schema.json",
  "title": "PokéSim KR Set",
  "description": "한국판 포켓몬 TCG 세트 1개의 메타·박스·확률·카드 데이터. 시뮬레이터의 정적 입력. 출처 메타(_source / _sample_size / _estimated_at)는 D-034·D-103 규약상 필수. D-139로 다중 세트 동시 시작이라 신상 추가 시 동일 스키마 재사용.",
  "type": "object",
  "required": [
    "code",
    "name_ko",
    "series",
    "type",
    "box_size",
    "pack_size",
    "box_price_krw",
    "pack_price_krw",
    "rarities",
    "box_guarantees",
    "pack_slots",
    "cards",
    "image_cdn_base",
    "_source",
    "_fetched_at"
  ],
  "properties": {
    "$schema": { "type": "string" },
    "code": {
      "type": "string",
      "pattern": "^[a-z0-9-]+$",
      "description": "내부 식별자. URL-safe 슬러그 (예: 'm4-ninja-spinner'). pokemoncard.co.kr 이미지 폴더(M4 등)와 매핑 가능."
    },
    "name_ko": {
      "type": "string",
      "description": "한국판 정식 명칭 (pokemoncard.co.kr 셀렉트 옵션 텍스트 그대로, 예: 'MEGA 확장팩 「닌자스피너」')."
    },
    "aliases": {
      "type": "array",
      "items": { "type": "string" },
      "description": "검색용 통칭/별칭. 정식 name_ko를 대체하지 않는다."
    },
    "name_en": {
      "type": ["string", "null"],
      "description": "영문판 매칭 (있으면). PokemonTCG.io 시세 매칭 시 사용."
    },
    "name_jp": {
      "type": ["string", "null"],
      "description": "일본판 매칭 (있으면)."
    },
    "series": {
      "type": "string",
      "enum": ["MEGA", "SV", "SM", "XY", "기타"],
      "description": "메이저 시리즈 라인."
    },
    "type": {
      "type": "string",
      "enum": ["expansion", "hi-class", "starter", "promo", "bundle"],
      "description": "팩 종류."
    },
    "release_date": {
      "type": ["string", "null"],
      "format": "date",
      "description": "한국판 발매일 YYYY-MM-DD (있으면)."
    },
    "box_size": {
      "type": "integer",
      "minimum": 1,
      "default": 30,
      "description": "박스 내 팩 수 (D-101: 박스 단위 시뮬 메인. 보통 30)."
    },
    "pack_size": {
      "type": "integer",
      "minimum": 1,
      "default": 5,
      "description": "팩 내 카드 수 (보통 5)."
    },
    "bonus_pack_count": {
      "type": "integer",
      "minimum": 0,
      "description": "본팩과 구분해 개봉하는 1장 프로모팩 수. 박스 기본 팩 수에는 포함하지 않는다."
    },
    "_jp_coverage_exclusions": {
      "type": "array",
      "description": "일본판에만 수록된 근거가 확인된 카드의 번호 대조 예외. 한국 공식 검색 부재만으로 추가하지 않는다.",
      "items": {
        "type": "object",
        "required": ["number", "reason", "source"],
        "properties": {
          "number": { "type": "integer", "minimum": 1 },
          "reason": { "type": "string", "minLength": 1 },
          "source": { "type": "string", "format": "uri" }
        }
      }
    },
    "box_price_krw": {
      "type": "integer",
      "minimum": 0,
      "description": "박스 정가 KRW (한국 시장 가격)."
    },
    "pack_price_krw": {
      "type": "integer",
      "minimum": 0,
      "description": "단일 팩 정가 KRW."
    },
    "rarities": {
      "type": "array",
      "items": { "type": "string" },
      "description": "세트에 등장하는 레어도 코드 (예: ['C','U','R','RR','SR','SAR','AR','UR'])."
    },
    "box_guarantees": {
      "type": "object",
      "required": ["rules", "_source", "_estimated_at"],
      "properties": {
        "rules": {
          "type": "array",
          "items": {
            "type": "object",
            "required": ["rarity", "min"],
            "properties": {
              "rarity": { "type": "string" },
              "kind": {
                "type": "string",
                "enum": ["mega-fixed-sr", "mega-main-high"]
              },
              "min": { "type": "integer", "minimum": 0, "description": "박스당 최소 보장 슬롯 수" },
              "max": { "type": ["integer", "null"], "minimum": 0 }
            }
          }
        },
        "_source": {
          "type": "string",
          "description": "출처 (예: '커뮤니티 합의 (디시 포카게갤 / X 종합)'). D-034·D-103 필수."
        },
        "_sample_size": { "type": ["integer", "null"], "description": "표본 크기 (있으면)." },
        "_estimated_at": { "type": "string", "format": "date" },
        "special_pack_evidence": {
          "type": "object",
          "additionalProperties": false,
          "required": ["kind", "composition", "observed_count", "sample_boxes", "sample_packs", "box_rate", "pack_rate", "_source", "_estimated_at"],
          "properties": {
            "kind": { "type": "string" },
            "composition": {
              "type": "object",
              "additionalProperties": { "type": "integer", "minimum": 1 }
            },
            "observed_count": { "type": "integer", "minimum": 1 },
            "sample_boxes": { "type": "integer", "minimum": 1 },
            "sample_packs": { "type": "integer", "minimum": 1 },
            "box_rate": { "type": "number", "minimum": 0, "maximum": 1 },
            "pack_rate": { "type": "number", "minimum": 0, "maximum": 1 },
            "_source": { "type": "string" },
            "_estimated_at": { "type": "string", "format": "date" }
          },
          "description": "발생 건수와 분모가 함께 확인된 세트별 특수팩 근거. 일반 봉입률 표본과 분리한다."
        }
      },
      "description": "박스 보장 룰 + 출처 메타 (D-103). 단일 인증글 메타로 박지 말 것."
    },
    "pack_slots": {
      "type": "array",
      "items": {
        "type": "object",
        "required": ["position", "weights", "_source", "_estimated_at"],
        "properties": {
          "position": {
            "type": "integer",
            "minimum": 1,
            "description": "팩 내 슬롯 번호 (1~pack_size). 동일 위치 슬롯은 같은 가중치."
          },
          "weights": {
            "type": "object",
            "additionalProperties": {
              "type": "number",
              "minimum": 0,
              "maximum": 1
            },
            "description": "레어도 → 가중치 매핑 (각 ≥ 0, 합 ≈ 1 권장)."
          },
          "_source": { "type": "string" },
          "_sample_size": { "type": ["integer", "null"] },
          "_estimated_at": { "type": "string", "format": "date" }
        }
      },
      "description": "팩 슬롯별 레어도 가중치 (D-034·D-035 정합, 임의 값 X)."
    },
    "bundle_components": {
      "type": "array",
      "minItems": 1,
      "items": {
        "type": "object",
        "required": ["set_code", "pack_count"],
        "additionalProperties": false,
        "properties": {
          "set_code": { "type": "string", "pattern": "^[a-z0-9-]+$" },
          "pack_count": { "type": "integer", "minimum": 1 }
        }
      },
      "description": "type='bundle' 혼합 상품에 동봉된 기존 확장팩 코드와 수량. 각 원본 세트의 낱팩 모델을 사용한다."
    },
    "cards": {
      "type": "array",
      "items": {
        "type": "object",
        "required": ["card_num", "number", "image_url", "_source"],
        "properties": {
          "card_num": {
            "type": "string",
            "description": "pokemoncard.co.kr CardNum (예: 'BS2026003001'). 카드 상세 페이지 URL 키."
          },
          "number": {
            "type": "integer",
            "minimum": 1,
            "description": "세트 내 번호 (1부터)."
          },
          "collector_number": {
            "type": "string",
            "description": "카드 실물의 번호 표기가 내부 정렬 번호와 다른 경우의 실제 표기."
          },
          "name_ko": {
            "type": ["string", "null"],
            "description": "카드 한국어 이름 (자동 수집 후 채움)."
          },
          "rarity": {
            "type": ["string", "null"],
            "description": "레어도 코드 (rarities 중 하나)."
          },
          "card_type": {
            "type": ["string", "null"],
            "enum": ["포켓몬", "트레이너", "에너지", null],
            "description": "카드 분류."
          },
          "subtype": {
            "type": ["string", "null"],
            "description": "ex / V / VMAX / VSTAR / GX / MEGA 등."
          },
          "hp": {
            "type": ["integer", "null"],
            "minimum": 0
          },
          "type": {
            "type": ["string", "null"],
            "description": "포켓몬 타입 (불꽃/물/풀/...)."
          },
          "image_url": {
            "type": "string",
            "description": "이미지 경로 (image_cdn_base와 결합). 예: 'wmimages/MEGA/M4/M4_001.png'."
          },
          "_source": {
            "type": "string",
            "description": "출처 URL (보통 pokemoncard.co.kr/cards/detail/{card_num})."
          },
          "_image_composite_source": {
            "type": "string",
            "format": "uri",
            "description": "V-UNION처럼 여러 실물 카드가 한 이미지로 제공될 때 사용한 공식 합본 이미지 URL."
          },
          "_image_crop_position": {
            "type": "string",
            "enum": ["top-left", "top-right", "bottom-left", "bottom-right"],
            "description": "공식 2x2 합본에서 이 카드가 차지하는 사분면."
          },
          "_image_crop": {
            "type": "object",
            "required": ["left", "top", "width", "height"],
            "additionalProperties": false,
            "properties": {
              "left": { "type": "integer", "minimum": 0 },
              "top": { "type": "integer", "minimum": 0 },
              "width": { "type": "integer", "minimum": 1 },
              "height": { "type": "integer", "minimum": 1 }
            },
            "description": "공식 합본 이미지에서 실물 카드 한 장을 추출할 정확한 픽셀 영역."
          },
          "_fetched_at": { "type": "string", "format": "date" }
        }
      },
      "description": "세트 카드 배열. 메타는 자동 수집 스크립트(scripts/fetch-pokemoncard.ts, PR 2b)로 채움."
    },
    "image_cdn_base": {
      "type": "string",
      "format": "uri",
      "default": "https://cards.image.pokemonkorea.co.kr/data/",
      "description": "이미지 CDN base URL. 카드 이미지 = base + image_url. R2 마이그레이션 후엔 자체 도메인으로 교체."
    },
    "start_deck": {
      "type": "object",
      "description": "type='starter'(스타트 덱 100) 전용. 박스/팩 봉입률이 아니라 '100개 일반 덱 + 특수 덱 + 골드 변형 덱 중 1개 무작위' 제품. 대표카드는 ex/메가 ex 기반 추정(공식 덱 구성 비공개).",
      "required": ["rep_card_nums", "special_rep_card_nums", "special_deck_rate", "_source", "_estimated_at"],
      "properties": {
        "deck_count": { "type": "integer", "minimum": 1, "description": "총 덱 수(일반 + 특수)." },
        "special_deck_no": { "type": "integer", "minimum": 1, "description": "특수 덱 번호(101번)." },
        "special_deck_rate": { "type": "number", "minimum": 0, "maximum": 1, "description": "특수 덱 등장 확률(추정치)." },
        "gold_deck_no": { "type": "integer", "minimum": 1, "description": "골드 변형 덱 번호(001번)." },
        "gold_deck_rate": { "type": "number", "minimum": 0, "maximum": 1, "description": "골드 변형 덱 등장 확률(추정치)." },
        "rep_card_nums": {
          "type": "array",
          "items": { "type": "string" },
          "description": "일반 덱(1~N) 대표카드 card_num 목록. 뽑기 시 균등 추첨."
        },
        "special_rep_card_nums": {
          "type": "array",
          "items": { "type": "string" },
          "description": "특수 덱(101번) 대표카드 card_num 목록(3장)."
        },
        "gold_rep_card_nums": {
          "type": "array",
          "items": { "type": "string" },
          "description": "골드 변형 덱(001번) 대표카드 card_num 목록(#766 MUR)."
        },
        "_source": { "type": "string" },
        "_estimated_at": { "type": "string", "format": "date" }
      }
    },
    "_source": {
      "type": "string",
      "description": "세트 데이터 1차 출처 도메인 (예: 'pokemoncard.co.kr')."
    },
    "_fetched_at": {
      "type": "string",
      "format": "date",
      "description": "데이터 수집(또는 마지막 갱신)일."
    },
    "_notes": {
      "type": ["string", "null"],
      "description": "내부 메모 (매핑 검증, 특이사항 등)."
    }
  }
}
